{
  "contract_version": "v4",
  "input_bundle_uri": "/tmp/sec-review-fixtures/repository-review-incremental",
  "review_intent": {
    "objective": "audit"
  },
  "scan_target": {
    "target_branch": "main",
    "default_branch": "main",
    "event_type": "scheduled",
    "scan_mode": "incremental",
    "base_sha": "1111111111111111111111111111111111111111",
    "head_sha": "2222222222222222222222222222222222222222",
    "commit_shas": [
      "2222222222222222222222222222222222222222"
    ]
  },
  "scan_scope": {
    "paths_ignore": [
      "dist/**"
    ],
    "incremental_changed_files": [
      {
        "path": "src/webhook.ts",
        "status": "modified",
        "previous_path": null
      }
    ]
  }
}
